Date,Text
2020-7-7,"['На Львівщині поліцейські оперативно затримали 51-річного батька з 35-річною дочкою, причетних до крадіжки з будинку. Про це, 7 липня, повідомили у відділі комунікації поліції у Львівській області.\n\nВчора, 6 липня, у Городоцьке відділення поліції надійшло повідомлення від мешканця одного з сіл району про те, що, близько 11:00 год., невідомі зловмисники проникли у його будинок та викрали значну суму грошей у гривнях та доларах США.\n\nОперативники управління карного розшуку поліції Львівщини спільно із співробітниками Стрийського відділу поліції встановили особи та затримали зловмисників, причетних до вчинення цього злочину — 51-річного мешканця Дрогобича та його 35-річну доньку.\n\n«За кілька годин правоохоронці розшукали та зупинили у місті Стрий автомобіль «Мерседес», яким пересувались зловмисники та затримали їх.  Проводились першочергові слідчі дії, під час яких у затриманих було вилучено значну суму грошей у різних валютах, а також інші речові докази причетності їх до вчинення крадіжки. Таке оперативне розкриття цього злочину стало можливим завдяки професійній та злагоджені роботі співробітників різних служб та підрозділів поліції Львівщини, а розкриття злочинів «за гарячими слідами», як у цьому випадку, дає ще й таку перевагу, що зловмисники не мають часу та можливості заховати викрадені гроші та речі і потерпілі можуть у найкоротші терміни отримати своє майно», — розповів  начальник Головного управління Національної поліції у Львівській області полковник поліції Василь Віконський.\n\nЗловмисники затримані в порядку ст. 208 Кримінального процесуального кодексу України, невдовзі суд обере їм запобіжні заходи.\n\nПравоохоронці встановлюють причетність затриманих до вчинення інших кримінальних правопорушень. Досудове розслідування триває.\n\n[gallery link=«file» ids=«205001,205002,205003»]', 'varta1.com.ua: Новини']"
2020-7-7,"['Пожежа сталася в Польщі, населеному пункті Погожице поблизу Хшанова (Малопольське воєводство). Про це повідомляє radiokrakow.pl.\n\nНа момент пожежі в будинку перебувало 12 людей, більшість з яких — українці.\n\nНаразі, ні поліція, ні прокуратура не надають подробиць, відомо лише, що затримані — двоє мешканців готелю. Вони поляки. Мотиви, чому вони це зробили, поліція поки не повідомила.\n\nНа місці пожежі працював експерт поліції. \n\nНаразі, відомо, що будівля — двоповерховий блок, покритий листовим металом. Вогонь охопив увесь перший поверх. \n\nМатеріали, використовувані для утеплення стін, тліли протягом багатьох годин. Пожежникам довелося демонтувати металеві частини конструкції, щоб  потрапити всередину.', 'varta1.com.ua: Новини']"
2021-7-7,"['', 'У середу, 7 липня, о 20:40 год, у Львові, в Шевченківському районі, сталася дорожньо-транспортна пригода. Про це інформує голова «Варта1» Ігор Зінкевич.', '«ДТП по вул. Жовківська–Дашкевича», — йдеться у дописі.', 'Внаслідок аварії, один з автомобілів вилетів на тротуар і врізався в стіну будівлі.', 'Обставини уточнюються, інформація буде оновлюватись.', 'varta1.com.ua: Новини']"
2021-7-7,"['Щоденний випуск новин за минулу добу 07.07:\n— у Стрию пострілами зі зброї вбито чоловіка;\n— у Львові горіли шини;\n— на Львівщині у ДТП потрапив бензовоз;\n— на Львівщині затримано пакистанців, які йшли до Польщі;\n— на Одещині ножем вбито жителя Львівщини;\n— на Франківщині, внаслідок аварії, загинули четверо людей;\n— безпека дітей на воді;\n— погода.', '', '', 'varta1.com.ua: Новини']"
2021-7-7,"['Перший заступник начальника департаменту патрульної поліції Києва Олексій Білошицький опублікував дані про поліцейського, якого сьогодні підстрелив чоловік.\n\nСергій Василенко — патрульний поліцейський Києва, 27 років, доєднався до лав патрульної поліції у 2019 році.\n\nВін колишній військовослужбовець з міцним здоров’ям, захоплюється мотоспортом.\n\n«Сьогодні під час виконання службового завдання Сергія було серйозно поранено пострілом з рушниці через двері. Це ситуація, яка ще раз доводить, що небезпека очікує патрульних навіть там, де її ніколи б не чекав. І будь-який виклик може стати останнім…\n\nСлужбу патрульного не можна порівнювати з цивільними професіями, як це часто звикли робити… але ось рівень заробітної плати, враховуючи всі ризики, також є «незрівненним». Цей виклик розділив життя Сергія на »до” і ”після”.\n\nНаразі, за його руку боряться найкращі фахівці лікарні ім. Шалімова і він вже переніс одну операцію. Надається максимальна допомога з лікування і реабілітації, але процес буде довгим і складним. І звісно, результат поки що невідомий.\n\nПатрульний залишиться в нашій сім’ї і на службі, не дивлячись на результат лікування, хоча ми віримо у повне відновлення!« — написав Білошицький.\n\nНагадаємо, сьогодні, працівники патрульної поліції виїхали на виклик щодо конфлікту у квартирі на проспекті Голосіївському. На місці події власник помешкання здійснив постріл із мисливської рушниці у напрямку поліцейських.\n\nВнаслідок події, правоохоронець отримав вогнепальне поранення руки, а інший чоловік — поранення в обличчя.\n\n[gallery link=»file« ids=»291403,291402,291401,291399,291398,291397""]', 'varta1.com.ua: Новини']"
2021-7-7,"['Мешканці Червонограда скаржаться, що місто останнім часом заполонили роми, які «не дають проходу», «чіпляються до всіх і крадуть».\n\nПро це повідомляють користувачі соцмереж.\n\n«Ходять і чіпляються до всіх! Крадуть! Ті цига** вже дістали. Роботи немає, то тільки випрошують. Раніше їх ж не було стільки багато. Де вони взялися?», — зазначається у дописі на сторінці спільноти «Підслухано в Червонограді».\n\nУ коментарях до публікації, городяни зокрема, зазначають, що «вони живуть у Закарпатті, а сюди на заробітки приїжджають».\n\n«Я одного разу в Восвині чекала на автобус до Червонограда, а рейс відмінили, і прийшлось сидіти на зупинці. Біля лісу. І прийшла молоденька циганка з немовлям. Теж чекала на автобус. Розговорились. От вона мені й розказала. Паспорт у неї забрав дядько. І гроші вона йому заробляє і віддає. На дитину отримує теж дядько. Короче, безвихідь. Мусиш просити, інакше помреш. А працювати не хочуть, мабуть. Бо я їй казала. У лісі стільки грибів — йди назбирай і продай. Та де там! Вона за день напросить більше ніж ті гриби коштують», — написала Людмила Креховец.\n\nДописувачка Елена Романова у своєму коментарі зазначила: «Прийшла одна циганка з дитинкою в під’їзд, стукала просила їсти і гроші. Ніхто не відкривав. Я зробила бутери, і мала речі дитячі: все саме краще лишила від малого, складені, лежали собі. Думаю, шкода її, віддам. Виходжу на вулицю через деякий час, ті речі всі розкидані за домом. То вона передивилася і викинула...».\n\n[gallery link=«file» columns=«1» ids=«291380»]', 'varta1.com.ua: Новини']"
2021-7-7,"['Сайти офісу президента, Служби безпеки та ряду інших державних структур раптово перестали працювати. Причиною тому стали хакерські атаки.\n\nЯк повідомляє  Державна служба спеціального зв’язку та захисту інформації України, 6 липня у другій половині дня відбувся аварійний технічний збій в роботі Інтернет-провайдерів, що забезпечують підтримку інтернет-представництв і сайтів президента України, Служби безпеки України та інших органів державної влади України.\n\nДержавним центром кіберзахисту  Держспецзв’язку визначено, що причинами технічного збою були:\n— атака типу «DNS Amplification» на сервери доменних імен, що забезпечують доступність вебресурсів органів державної влади;\n— мережева атака, спрямована на порушення сервісу маршрутизації мережевого трафіку, що спричинила тимчасову недоступність резервних маршрутів та відповідних вебресурсів.\n\nЗасобами Системи виявлення вразливостей і реагування на кіберінциденти та кібератаки зафіксовано аномальні події на обладнанні системи захищеного доступу державних органів до мережі інтернет.\n\nЗа результатами атаки зареєстровано відповідний кіберінцидент, триває розслідування.', 'varta1.com.ua: Новини']"
2021-7-7,"['У Львові чоловік розбився на смерть, зірвавшись з балкону. 30-річний львів’янин мав намір з балкону сусідського будинку потрапити на балкон свого будинку, проте не втримався та впав з висоти третього поверху.\n\nЯк повідомляє Нацполіція Львівської області, сьогодні, 7 липня, о 12:15 год, до поліції надійшло повідомлення про те, що на вулиці Лобачевського, у Львові, внаслідок падіння з висоти, загинув чоловік. На місці події працювала слідчо-оперативна група відділу поліції № 4 Львівського районного управління поліції.\n\nПравоохоронці встановили особу загиблого — 30-річного місцевого мешканця. Також попередньо встановлено, що чоловік намагався через балкон сусідського будинку потрапити на балкон свого будинку. Проте, не втримався та впав з висоти третього поверху, отримавши при цьому тілесні ушкодження, від яких помер на місці події.\n\nЗа фактом слідчі територіального підрозділу відкрили кримінальне провадження за ч. 1 ст. 115 (умисне вбивство) Кримінального кодексу України з приміткою «нещасний випадок». Поліцейські з’ясовують обставини події.\n\nЯк повідомляла «Варта1», у Львові чоловік зірвався з висоти намагаючись потрапити через вікно у власну квартиру.', 'varta1.com.ua: Новини']"
2021-7-7,"['Сьогодні, 7 липня, до Львова прибув рейс авіакомпанії «Flynas»!\n\nЛітак «Airbus A320 Neo» прилетів з міста Ель-Касім, що знаходиться у Саудівської-Аравії. Вже за традицією борт зустріли водяною аркою.\n\nНагадаємо, 3 липня цей перевізник, вже відкрив рейс з міста Ер-Ріад.\n\nФото: Юрій Танчин, Василь Садовий\n\n[gallery link=«file» ids=«291337,291338,291339,291340,291341,291342,291343,291344,291345,291346,291347,291355»]', 'varta1.com.ua: Новини']"
2021-7-7,"['Вночі, 7 липня, водій автомобіля «Volkswagen Tiguan», рухаючись у напрямку Микуличина, на заокругленій ділянці дороги не справився з керуванням і злетів з дороги в обрив. Внаслідок аварії, автомобіль перекинувся на дах. У поліцію повідомленням про ДТП надійшло о 11:45 год, від місцевої мешканки, яка виявила перекинуте авто. На місце події одразу виїхали медики, рятувальники і поліцейські. Аварія сталася на трасі Н-09 в місті Яремче.\n\nЯк повідомляє Нацполіція Івано-Франківської області, встановлено, що автівкою керував 29-річний мешканець Кропивницького, який, від отриманих травм, загинув на місці події з трьома пасажирами: 29-річною жінкою (мешканка Кропивницького), 37-річним і 38-річним чоловіками (мешканці Яремче).\n\nЗа фактом дорожньо-транспортної пригоди правоохоронці розпочали кримінальне провадження за ч. 3 ст. 286 Кримінального кодексу України. Що стало причиною аварії — встановить слідство у ході досудового розслідування.\n\nЯк повідомляла «Варта1», в Яремче легковик злетів з дороги у прірву: встановлюють особи чотирьох загиблих.\n\n[gallery columns=«5» link=«file» ids=«291349,291350,291351,291352,291353»]', 'varta1.com.ua: Новини']"
