Date,Text
2021-7-7,"['У Львові на місці колишнього офісу Компартії хочуть облаштувати магазин.\n\nЯк повідомляє «ГалІнфо», квартиру за адресою: м. Львів, вул. Коновальця 7/1, у якій раніше знаходився офіс львівського обкому КПУ та яка в останні роки підпільно здавалась в оренду для проведення різноманітних масових заходів усім охочим, планують пристосувати під магазин.\n\nЗробити це хоче її новий власник — Браун Дімітрі, який придбав дане помешкання (загальною площею 92,3 кв. м) у Голуба Володимира Івановича — батька екс-народного депутата-комуніста Голуба Олександра Володимировича.\n\nКвартира № 1 на вул. Коновальця, 7, у Львові, звідки раніше регулярно доносився спів «Інтернаціоналу» та вікна якої раніше регулярно били камінням, знову опинилася в епіцентрі скандалу. На цей раз — у зв’язку з намаганнями нового власника квартири Брауна Дімітрі реконструювати це помешкання та облаштувати магазин — шляхом «відновлення дверного прорізу» на місці віконного отвору.\n\nАби реалізувати цю задумку, Браун Дімітрі скерував відповідне звернення до Львівської міськради. Виконавчий комітет ЛМР розглянув його на засіданні 21 травня 2021 року. За результатами розгляду було ухвалено рішення «Про затвердження містобудівних умов та обмежень для проектування об’єкта будівництва на реконструкцію гр. Браун Дімітрі з пристосуванням квартири № 1 під магазин з відновленням дверного прорізу на місці віконного отвору на вул. Є. Коновальця, 7 у м. Львові».\n\nВодночас, дане погодження викликало обурення в мешканців будинку на Коновальця, 7, які стверджують, що отвору для дверей за проектом «там» ніколи не було, і що міська рада погодила вирізати двері у фасаді історичного будинку під магазин без їхньої згоди.\n\nЗа наявною інформацію, через це погодження нещодавно відбулися загальні збори ОСББ «Під орлами», якому належить будинок, а також було проведено письмове опитування мешканців. Всі мешканці висловилися проти того, щоб вирізали двері у фасаді будинку. У ОСББ заявляють, що дану справу просто так не залишать, не виключають, що у випадку бездіяльності архітектурних інстанцій Львова вирішуватимуть її у суді.\n\nНагадаємо, що в квартира за адресою вул. Коновальця 7/1, яка тривалий час слугувала місцем для партійних зібрань львівських комуністів, в останні роки підпільно (без сплати податків) здавалась в оренду для проведення різноманітних масових заходів усім охочим. Відомо, зокрема, й те, що у помешканні функціонував навчальний центр «Training Service Lviv». На його сайті зазначалося, що центр проводить навчальні, коучингові заходи, об’єднуючи тренерів різних напрямків навчання з багаторічним досвідом і тисячами годин тренерської, коучінгової, психологічної та консалтингової роботи.\n\nПро будівлю на вулиці Коновальця під номером 7 відомо, що її понад сто років тому спроектував архітектор Каспер Драневич. Будинок має назву «Під орлами». 2003 року за проєктом та керівництвом скульптора Любомира Кукіля відбулася реконструція фігури орлів на фасаді будинку.\n\n[gallery link=«file» columns=«1» ids=«291279»]', 'varta1.com.ua: Новини']"
2021-7-7,"['Невідомі наклали каміння та шини на рейки перед пасажирським поїздом у середмісті Одеси.\n\nЯк повідомляє «Укрзалізниця», шостого липня на 1496 км перегону «Одеса–Застава-1» — ст. Усатове група сторонніх осіб створила загрозу безпеці руху пасажирського поїзда.\n\nТак, близько 14 години, машиніст електропоїзда «Інтерсіті» № 761 «Київ–Одеса» застосував екстрене гальмування для запобігання наїзду на каміння і шини.\n\nНа щастя та завдяки оперативним діям машиніста, наїзду вдалось уникнути.\n\nПід час огляду було виявлено факт накладання каміння та шин на обидві рейкові нитки. Локомотивна бригада прибрала сторонні предмети із колії. Пасажирський поїзд № 761 «Київ–Одеса» затримався на 3 хв.\n\n«Залізничники стурбовані ситуацією, адже подібні втручання можуть перешкодити стабільній роботі залізниці, завдати значних матеріальних збитків та у випадку аварії призвести до людських жертв», — наголошується у повідомленні.', 'varta1.com.ua: Новини']"
2021-7-7,"['У Міністерстві закордонних справ України повідомили, що загрози життю українців, гелікоптер з яким упав в озеро в Польщі, немає.\n\nЯк пише «УНІАН», з посиланням на речника Міністерства закордонних справ України Олега Ніколенко, 6 липня, внаслідок падіння цивільного вертольота в озеро Талти у Вармінсько-Мазурському воєводстві, троє громадян України отримали травми: пілот та двоє пасажирів.\n\n«Постраждалі українці госпіталізовані, їхній стан стабільний, загрози життю немає», — зазначив Ніколенко.\n\nВін додав, що Консульство України в Ґданську надає громадянам необхідну допомогу, взаємодіє із правоохоронними органами та Державною комісією Польщі з розслідування авіаційних аварій задля з’ясування причин падіння, а також підтримує контакт із лікарнею.\n\nУ Польщі впав вертоліт з українцями: що відомо\n\n6 липня з’явилася інформація, що на озері Талти у Вармінсько-Мазурському воєводстві Польщі сталася авіапригода — гелікоптер з пасажирами упав у воду.\n\nЗа словами очевидців, невдовзі після зльоту у транспорту почалися проблеми з двигуном.\n\nНа борту перебували й українці, які проживають у Польщі. Проїжджаючі на катері туристи підібрали постраждалих. Трьох пасажирів з травмами госпіталізували.', '', '', 'varta1.com.ua: Новини']"
2021-7-7,"['У Києві триває спеціальна поліцейська операція. Під час перемовин зловмисник скоїв підпал квартири, де він зачинився.\n\nПро це повідомляє МВС України у «Telegram».\n\nЯк зазначається, рятувальниками ДСНС проведено заходи щодо ліквідації пожежі. Наразі, працівники поліції евакуюють мешканців житлового будинку.\n\n«Поліцейські затримали озброєного зловмисника, який поранив патрульного та цивільну людину, після чого зачинився у квартирі житлового будинку на проспекті Голосіївському і вчинив там підпал», — повідомили в МВС України.\n\nЯк повідомлялося, у Києві працівники патрульної поліції виїхали на виклик щодо конфлікту у квартирі на проспекті Голосіївському. На місці події власник помешкання здійснив постріл із мисливської рушниці у напрямку поліцейських. Правоохоронець отримав вогнепальне поранення руки, а інший чоловік — поранення в обличчя. Після цього зловмисник зачинився в зазначеній квартирі.\n\n[gallery link=«file» ids=«291262,291261,291264»]\n\nЯк пише «УНІАН», брат чоловіка, який імовірно поранив двох правоохоронців у Голосіївському районі Києва, розповів відомі йому подробиці інциденту зі стріляниною. За його словами, у чоловіка рейдерським шляхом намагаються відібрати квартиру. Він також зміг додзвонитися до стрільця в прямому ефірі.\n\n«Брат подзвонив, приїдь, допомагай. Незаконно хочуть зламати квартиру... це ми викликали одразу поліцію, тому що [вони] хотіли незаконно заволодіти квартирою», — розповів родич стрілка.', 'varta1.com.ua: Новини']"
2021-7-7,"['', 'На Львівщині  чоловік жорстоко побив батька, який від отриманих травм помер.', 'Як повідомляє Нацполіція Львівської області, 6 липня, у поліцію надійшло повідомлення від мешканця одного з сіл Самбірського району про те, що прийшовши додому до тестя, він виявив його тіло без ознак життя зі слідами побоїв.', 'За вказаною адресою негайно виїхали: слідчо-оперативна група, група реагування патрульної поліції, дільничний офіцер та співробітники інших служб відділення поліції № 2 Самбірського районного відділу поліції. На тілі 74-річного мешканця будинку правоохоронці виявили чисельні тілесні ушкодження, які й спричинили смерть. Зокрема, у чоловіка були зламані ребра та грудна клітина.', 'Проведеними заходами поліцейські встановили, що до скоєння злочину причетний 44-річний син загиблого. Напередодні, близько 23:00 год, він, перебуваючи у стані алкогольного сп’яніння, прийшов у будинок батька, вчинив з ним конфлікт, під час якого жорстоко побив, спричинивши тілесні ушкодження. Від отриманих травм пенсіонер помер.', 'За фактом слідчі територіального підрозділу поліції відкрили кримінальне провадження за ч. 2 ст. 121 (умисне тяжке тілесне ушкодження) Кримінального кодексу України. Санкція статті передбачає покарання — позбавлення волі на термін від семи до десяти років.', 'Зловмисник затриманий у порядку ст. 208 Кримінального процесуального кодексу України, невдовзі суд обере йому запобіжний захід.', 'Досудове розслідування триває.', 'varta1.com.ua: Новини']"
2021-7-7,"['У Києві працівники патрульної поліції виїхали на виклик щодо конфлікту у квартирі на проспекті Голосіївському. На місці події власник помешкання здійснив постріл із мисливської рушниці у напрямку поліцейських. Правоохоронець отримав вогнепальне поранення руки, а інший чоловік — поранення в обличчя. Після цього зловмисник зачинився в зазначеній квартирі.\n\nЯк повідомляє Національна поліція України, працівники патрульної поліції виїхали на виклик щодо конфлікту у квартирі на проспекті Голосіївському. На місці події власник помешкання здійснив постріл із мисливської рушниці у напрямку поліцейських.\n\nЯк повідомив начальник поліції Києва Андрій Крищенко, внаслідок події правоохоронець отримав вогнепальне поранення руки, а інший чоловік — поранення в обличчя. Після цього зловмисник зачинився в зазначеній квартирі.\n\n«Наразі, у столиці введена спеціальна поліцейська операція для затримання зловмисника. Потерпілим надають необхідну медичну допомогу. Вживаються усі заходи, спрямовані на затримання правопорушника. Задіяні спецпризначенці», — зазначив Андрій Крищенко, який зараз перебуває на місці події.\n\nОкрім того, на адресі працюють слідчо-оперативні групи Головного та районного управлінь поліції.\n\n[gallery link=«file» columns=«4» ids=«291250,291251,291253,291254»]', 'varta1.com.ua: Новини']"
2021-7-7,"['Жінку, яка заморила голодом свою дитину, засуджено до 12 років позбавлення волі.\n\nЯк повідомляє пресслужба Київської міської прокуратури,  за результатами підтримання публічного обвинувачення прокурорами Голосіївської окружної прокуратури міста Києва до 12 років позбавлення волі засуджено жінку, яка на 11 днів залишила в квартирі двох своїх дітей, один з яких помер від голоду.\n\nНагадаємо, на початку грудня 2016 року обвинувачена на 11 днів залишила в квартирі двох своїх дітей — однорічного сина та дворічну доньку. Повернувшись додому, жінка виявила хлопчика мертвим, а дівчинку — без свідомості.\n\n29 серпня 2019 року Голосіївський районний суд міста Києва засудив обвинувачену до 8 років за ч. 3 ст. 135 КК України (залишення в небезпеці).\n\nОскільки прокуратура наполягала на призначенні жінці довічного позбавлення волі за п. 2 ч. 2 ст. 115 КК України (умисне вбивство малолітньої дитини), вказаний вирок був оскаржений в апеляційній інстанції.\n\n18 грудня 2019 року Київський апеляційний суд задовольнив апеляційну скаргу прокуратури міста Києва, скасував вирок Голосіївського райсуду столиці, а кримінальне провадження направив на новий судовий розгляд у той же суд в іншому складі суду.\n\nУ ході судового розгляду прокурор повністю довів  вину обвинуваченої та вироком Голосіївського районного суду від 5 липня 2021 року жінку визнано винною у вчиненні злочину за п. 2 ч. 2 ст. 115 КК України та засуджено до 12 років позбавлення волі.\n\nОбвинувачена перебуває під вартою.\n\nПісля вивчення тексту вироку окружною прокуратурою буде вирішено питання про можливість внесення апеляційної скарги.', 'varta1.com.ua: Новини']"
2022-7-7,"['Президент Володимир Зеленський описав усю ту допомогу, яку Велика Британія надала Україні за прем’єрства Бориса Джонсона. Водночас, глава держави сказав, що після відставки очільника уряду ця підтримка не зміниться. Лише на потреби безпеки і оборони України з боку Британії було виділено більше 2 млрд фунтів від 24 лютого.', 'Про це глава держави Володимир Зеленський сказав у відеозверненні.', '«Сьогодні головною темою в нашій країні стала британська тема. Рішення Бориса Джонсона залишити посаду голови партії і прем’єр-міністра. Вдень я говорив з ним, подякував за підтримку, яку ми отримали від першого дня російського терору. Передусім, це зброя, комплекси протиповітряної оборони, «STINGER» і протитанкові системи «NLAW», а ще артилерія, боєприпаси, броньовані машини і багато-багато всього іншого. Вагома політична підтримка, сильні санкції проти росії, фінансова допомога нашій державі. Лише на потреби безпеки і оборони виділено більше 2 млрд фунтів від 24 лютого», — розповів Зеленський.', 'Він наголосив, що роль Британії глобальна у захисті свободи. ', '«І хоча це відображення позиції британського суспільства, але все ж таки лідерство і харизма очільника держави завжди мають особливе значення. Тим більше, у такий час — час повномасштабної антиєвропейської війни росії, яка розпочала наступ на Європу саме з нашої держави. Тож не дивно, що українці відчувають особисту вдячність Борису», — сказав президент.', 'Він зауважив, що не варто забувати, що «відносини між нами будуємо між державами».', '«Підтримка Великою Британією України не має змінитися, хоч би що відбувалося в лондонських владних колах, — і Борис, і всі наші друзі у Сполученому Королівстві запевнили мене в цьому», — резюмував глава держави.', 'Нагадаємо, що сьогодні, 7 липня, Борис Джонсон оголосив про свою відставку з поста лідера Консервативної партії та він залишається на посаді прем’єр-міністра, доки не буде обрано наступника.', 'varta1.com.ua: Новини', 'Ілона Мартинюк']"
2022-7-7,"['Начальник штабу оборони Великої Британії адмірал Тоні Радакін зустрівся в Україні із головнокомандувачем ЗСУ Валерієм Залужним і обговорив  з ним деталі планів майбутніх операцій. ', 'Про це повідомив Генштаб ЗСУ.', '«Ми дуже плідно попрацювали на пункті управління, обговорили до деталей плани майбутніх операцій. Як військові люди, розуміємо ситуацію такою, як вона є, і віддаємо всі сили боротьбі за свободу», — зазначив Залужний.', 'Радакін відзначив, що для нього «велика честь відвідати Київ та зустрітися з моїм українським колегою генералом Залужним».', '«Я сповнений захоплення ЗСУ, їхньою мужністю, стійкістю та винахідливістю у протистоянні незаконній та варварській агресії росії», — наголосив адмірал.', '«Мій 48-годинний візит дав мені змогу краще зрозуміти оперативні перспективи та обговорити, як Велика Британія може продовжувати підтримувати Україну. І як ми можемо сприяти іншим міжнародним партнерам та союзникам у допомозі ЗСУ найближчими тижнями та місяцями», — доповнив Радакін.', 'Фото: Генштаб ЗСУ', '', '', 'varta1.com.ua: Новини', 'Ілона Мартинюк']"
