Date,Text
2022-7-7,"['Уряд повністю виконав програму «єПідтримка», у межах якої постраждалі від війни українці отримували допомогу в розмірі 6500 грн.', 'Про це повідомив прем’єр-міністр України Денис Шмигаль на засіданні уряду 7 липня.', 'Шмигаль уточнив, що грошову допомогу отримали 5 млн громадян України.', '«Програма «єПідтримка», яку уряд запустив за ініціативою президента в березні цього року, повністю реалізована. Усі, хто подав заявку на виплату в розмірі 6500 грн, кошти отримали. Це майже 5 млн громадян і 30,9 млрд грн», — повідомив прем’єр.', 'За його словами, надалі на картку «єПідтримка» можна буде отримати дохід від військових облігацій. ', '«Відповідне рішення ухвалили на сьогоднішньому засіданні. Спільна робота та підтримка один одного — це формула успіху нашої держави й перемоги у війні», — поінформував Шмигаль.', 'Нагадаємо, що  у застосунку та на порталі «Дія» можна оформити статус безробітного та отримувати щомісячну допомогу.', 'varta1.com.ua: Новини', 'Ілона Мартинюк']"
2022-7-7,"['7 липня кримське управління ФСБ повідомило про порушення кримінальної справи стосовно військового комісара Криму Юрія Лимаря за статтями про зловживання посадовими повноваженнями та отримання хабаря.', 'Як повідомляє «Фокус», російські силовики заявили, що Лимар за хабарі звільняв кримчан від призову на строкову військову службу, надаючи своїм підлеглим відповідні розпорядження. Зараз вирішується питання про запобіжний захід для підозрюваного.', 'Також повідомляють, що кримінальні справи порушили проти військкома Джанкоя, начальника відділу призову військового комісаріату Білогірська та начальник відділу призову Сімферопольського військкомату.', 'У представництві президента України в Автономній республіці Крим днями заявили про те, що на окупованому півострові, ймовірно, розпочинається підготовка до оголошення мобілізації, щоб поповнити склад російських військ, що воюють проти України.', 'Такого висновку дійшли, вивчивши указ голови окупаційної адміністрації Криму Сергія Аксьонова, який розпорядився створити «призовну комісію з мобілізації громадян» у новому складі. Також Аксьонов доручив створити відповідні комісії нижчого рівня у всіх районах півострова.', '', '', '', '', 'Як повідомлялося, у Криму через сильні зливи підтоплено села та міста.', 'varta1.com.ua: Новини', 'Володимир Садовий']"
2022-7-7,"['Сьогодні, 7 липня, на Львівщині сталася ДТП. Про це повідомляє «Варта 1».', 'На трасі «Київ–Чоп», поблизу села Гірне, зіткнулися легковий автомобіль «Ford» та вантажівка «Volvo».', 'Водій автомобіля «Ford» загинув на місці автопригоди.', 'На місці події працюють поліцейські.\n ', '', '', 'Раніше, у Львові зіткнулися два автомобілі.', 'varta1.com.ua: Новини', 'Ольга Чобіт']"
2022-7-7,"['Поїзд вирушатиме по парних числах із Запоріжжя з 26 липня о 15:03 год. і прибуватиме до Ужгорода о 15:27 год. наступного дня, повідомляє «Укрзалізниця».', 'У зворотному напрямку, з Ужгорода, поїзд вирушатиме по парних числах об 11:35 год. і прибуватиме до Запоріжжя о 12:21 год.', 'Квитки будуть доступні онлайн на сайті, у чат-ботах та касах з 8 липня.', 'Як повідомлялося, з 9 липня курсуватиме ще один поїзд «Інтерсіті» Київ–Львів.', 'varta1.com.ua: Новини', 'Володимир Садовий']"
2022-7-7,"['У четвер, 7 липня, міський голова міста Білгород-Дністровський, що в Одеській області, Віталій Граждан під час засідання міськради побився з головою районної ради Григорієм Мальниченком. Останній накинувся на мера після прямих звинувачень у наркоманії.', 'Відповідне відео оприлюднив місцевий «Telegram»-канал, пише «Телеграф».', 'Судячи з кадрів, бійка зав’язалася через зухвалий тон мера Білгорода-Дністровського, який спочатку відмовився ввічливо звертатися до голови райради, а потім назвав його «наркоманом». Мальниченко вирішив не терпіти образу й накинувся на свого опонента з кулаками. Присутні у залі засідань взялися рознімати обох чоловіків по різні сторони барикад, але й після того емоції не вщухли й обоє представників місцевої влади перейшли на словесні образи. Мальниченко звинуватив Граждан у «нетрадиційній сексуальній орієнтації» (звісно, що вислів обрав максимально грубий), а Граждан продовжив наполягати на залежності свого опонента від наркотичних речовин.', '', '', 'Як повідомлялося, на Одещині працівник розрив могилу й розбив кришку труни колишнього начальника.', 'varta1.com.ua: Новини', 'Володимир Садовий']"
2022-7-7,"['Сьогодні, 7 липня, у Львові сталася дорожньо-транспортна пригода. Про це повідомляє «Варта 1».', 'Автопригода сталася на вулиці Луганській.', 'У ДТП зіткнулися два авто, за попередніми даними один з водіїв не надав перевагу у русі іншому.', 'Потерпілих, внаслідок ДТП, не має.', 'Рух вулицею не ускладнений.', 'На місці ДТП працює патрульна поліція.', '', '', '', '', 'varta1.com.ua: Новини', 'Ольга Чобіт']"
2022-7-7,"['Російські туристи, які відпочивають у Греції, поскаржилися на жахливе ставлення. Мандрівники стверджують, що в їхній бік тицяли пальцями, кричали «f*ck Russians!» та пошкоджували майно.', 'Як пише «Оbozrevatel», жінка, яка проводила відпустку на острові Кос, нібито «постраждала» від рук британців. Інцидент трапився під час пікніка на березі.', '«Ми вирішили пройтися вздовж берега. Повертаємось, а наші речі вивернуті навиворіт, їжа в піску, взуття розкидане», — повідомила туристка.', 'За її словами, поряд відпочивали люди, схожі на британців. Пізніше вони прокричали услід «f*ck Russians!».', 'Ще одна росіянка поскаржилася на схоже ставлення в Афінах. Вона розповіла, що сидячи у кафе почула у свій бік образи від жінки, схожої на туристку із Північної Європи.', '«Уявіть: ви нікого не чіпаєте, а у вас мало не тицяють пальцем з вереском: «Вас не має бути тут, сидіть вдома і не ганьбіться»», — заявила мешканка РФ.', 'Вона додала, що образницю попросили залишити заклад, а власник вибачився і як моральну шкоду приніс десерт.', 'У свою чергу, турагенти в Греції підтвердили чутки про русофобію. Особливо поза туристичними зонами.', '«Були публікації в місцевих ЗМІ про те, що на ринку жінка пирснула парі росіян в обличчя перцевим газом за те, що вони розмовляли російською мовою. На набережній було декілька випадків, коли росіянок штовхнули і образили за російську мову», — сказала власниця туркомпанії на острові Корфу.', 'А от у бюро індивідуальних екскурсій в Афінах стверджують, що русофобія є не лише у Греції. Там кажуть, що часто трапляються випадки, коли росіян ображають, а іноді справа доходить і до рукоприкладства чи пошкодження майна.', 'Раніше представник найбільшого європейського туроператора «TUI Tantur» направив готелям Туреччини вимогу, в якій йдеться про необхідність скасувати броню всіх туристів з Росії.', 'Як повідомлялося, найбільший туроператор ЄС вимагає від готелів Туреччини не приймати росіян.', 'varta1.com.ua: Новини', 'Володимир Садовий']"
2022-7-7,"['На війні загинув 51-річний військовий Ігор Івасик. Він служив у лавах 80-ї ОДШБ, повідомили у Рогатинській територіальній громаді.', 'Ігор Івасик пішов захищати Україну від загарбників практично у перші дні війни — 3 березня.', 'Був військовим 80-ї окремої десантно-штурмової бригади ДШВ Збройних сил України.', 'Загинув захисник України 5 липня на 52-му році життя поблизу населеного пункту Спірне, Бахмутського району, Донецької області, від численних вибухових травм.', '«Ти віддав життя, щоб ми жили, за наші мирні світанки, спокійний сон, за майбутнє наших дітей, за їх посмішки, за наших батьків, за Україну. Світла пам’ять бійцю 80-ї ДШБ, нашому Герою Ігорю Івасику», — зазначила сестра захисника Оксана Івасик.', 'Прощання з Героєм відбудеться у Львові, де народився і мешкав захисник.', 'Як повідомлялося, зустрів тіло сина і помер батько захисника з Волині.', 'varta1.com.ua: Новини', 'Володимир Садовий']"
2022-7-7,"['У республіці білорусь продовжили дію зони обмеження польотів для всіх типів цивільних суден, включаючи безпілотники, на висотах від 0 до 19 800 метрів на півдні країни. Згідно з документом NOTAMN O0547/22, тепер рішення буде діяти з 8 липня до 7 жовтня 2022 року.', 'Цей захід був введений після початку повномасштабного вторгнення росії в Україну для нанесення ракетних ударів по нашій державі з території РБ. І якщо спиратися на нові терміни, то протягом трьох наступних місяців загроза бомбардувань з боку білорусі буде зберігатися.', 'Цією інформацією поділився портал «Беларускі Гаюн», який відстежує всі обстріли України з боку білорусі, пише «УНІАН».', 'У документі NOTAMN O0547/22 сказано, що обмеження не стосується авіації ЗС РБ і Держприкордонкомітету РБ. Позначена територія, де заборонені польоти, не змінилася.', 'Рішення охоплює південь білорусі, так як саме з цієї частини держави найчастіше наносяться удари по Україні. З початку повномасштабної війни з території РБ по нашій державі було випущено не менше 689 снарядів.', 'Нагадаємо, російські окупанти застосовують оперативно-тактичні комплекси «Іскандер» для обстрілів України з білорусі. А в кінці травня РФ використала територію РБ для нанесення ударів з далеких бомбардувальників Ту-22М3.', 'Як повідомлялося, білорусь погрожує ударами по території Польщі.', 'varta1.com.ua: Новини', 'Володимир Садовий']"
2022-7-7,"['Рішенням Ради оборони області на Рівненщині заборонено продаж та запуск феєрверків, салютів і інших піротехнічних засобів, повідомив керівник Рівненської ОВА Віталій Коваль.', 'Заборонено рух транспортних засобів, у конструкції яких є система випуску відпрацьованих газів з прямотоком та інші вихлопні системи, де відсутній шумопоглинач (рух автомобілів та мотоциклів без глушників).', 'Заборона діятиме до скасування режиму воєнного стану.', '', '', 'Як повідомлялося, буковинець, який запустив салюти, отримав повістку.', 'varta1.com.ua: Новини', 'Володимир Садовий']"
2022-7-7,"['Армія білорусі готова нанести удари по території Польщі у відповідь на можливі “провокації країн Заходу”,  заявив  начальник головного розвідувального управління — заступник начальника Генерального штабу збройних сил білорусі генерал-майор Руслан Косигін, повідомляє «Мілітарний».', 'За словами Косигіна, білорусь готова адекватно відповідати на провокації Заходу, територія Польщі з її військовою інфраструктурою у разі початку такого конфлікту стане першочерговим об’єктом удару.', 'Також Косигін зазначив, що білорусь готова до різних сценаріїв розвитку ситуації.', '“Не хотілося б, щоб цей сценарій був військовим, але на Заході повинні чітко розуміти, що наша відповідь на будь-які озброєні провокації однозначно буде адекватною і жорсткою”, — пояснив Косигін.', 'Заступник начальника Генштабу збройних сил РБ вважає, що підтвердженням цих “задумів”, є заходи оперативної та бойової підготовки країн Альянсу, що проводяться в прилеглих до білорусі країнах, і де як противник розглядаються саме РФ та білорусь.', '“Територія Польщі, як, втім, і країн Балтії, перетворюється на полігон, на території якого США планують розв’язати в Європі ще один кривавий конфлікт проти Російської Федерації та її союзників”, — заявив генерал-майор.', 'Нині, за його словами, у Польщі завершується процес введення в експлуатацію бази протиракетної оборони.', 'Косигін вважає, що Вашингтон і Брюссель під приводом стримування загрози зі сходу відпрацьовує механізм створення угруповань військ для їх можливого застосування на відповідних операційних напрямках проти росії та білорусі.', 'Як повідомлялося, Лукашенко заявив, що участь білорусі у «спецоперації» визначена давно.', 'varta1.com.ua: Новини', 'Володимир Садовий']"
2023-7-7,"['Внаслідок нічної ворожої атаки 6 липня 2023 року пошкоджено майно жителів громади у селах Хильчиці та Велика Вільшаниця. Про це повідомила Золочівська міська рада Золочівського району Львівської області.', 'У селі Велика Вільшаниця пошкоджено 9 житлових будинків та 10 господарських будівель', 'У селі Хильчиці 5 житлових будинків та 2 господарських будівлі.', 'Читайте також: у Львові сьогодні та завтра прощатимуться з Анастасією Сенів та Мирославою Садовою', 'Також пошкоджене приміщення бібліотеки с. Хильчиці.', 'varta1.com.ua: Новини', 'Ольга Чобіт']"
2023-7-7,"['Завтра, 8 липня погоду на Львівщині визначатиме поле підвищеного атмосферного тиску. Про це повідомляє Львівський гідрометцентр.', 'По Львівській області буде мінлива хмарність, без опадів. Вночі та вранці слабкий туман. Вітер північний, 5 – 10 м/с. Температура вночі 10 – 15°, вдень 22 – 27° тепла.', 'По місту Львову буде мінлива хмарність без опадів. Вночі та вранці слабкий туман. Вітер північний, 5 – 10 м/с. Температура вночі 12 – 14°, вдень 24 – 26° тепла.', 'Погіршення видимості в тумані 500 – 1000 м.', 'Атмосферний тиск вночі зростатиме, вдень слабо падатиме, відносна вологість повітря дещо зменшиться.', 'varta1.com.ua: Новини', 'Ольга Чобіт']"
2023-7-7,"['У середу, 5 липня, захищаючи Україну від російських окупантів, загинув юний Захисник з Гніздичева молодший сержант Ференс Назарій Тарасович 2000 року народження.', 'Біда сталася в районі н.п. Кліщіївка Бахмутського району Донецької області. Назарій отримав мінно-вибухове осколкове поранення несумісне з життям і загинув.', 'Відповідно до розпорядження селищного голови, з метою належного вшанування пам’яті загиблого військовослужбовця Збройних сил України, жителя смт. Гніздичів – Ференса Назара Тарасовича, 7-9 липня 2023 року в Гніздичівській територіальній громаді оголошено Днями жалоби.', '8 липня 2023 року через населені пункти Жидачівської громади, села Дем’янка-Наддністрянська, Заріччя, Іванівці та місто Жидачів, рухатиметься жалобний кортеж.', 'Читайте також: сестра журналіста Варта1, яку вбила російська ракета, готувалася до весілля.', 'По місту Жидачеву жалобний кортеж рухатиметься від мостового переходу через р. Стрий вул. М. Шашкевича (зупинка біля храму Воскресіння Господнього), вул. Кобзаревою, вул. Данила Галицького та вул. Січових Стрільців – дальше до смт. Гніздичева. ', 'varta1.com.ua: Новини', 'Ольга Чобіт']"
